{
  "evidenceKind": "agent-eval-result",
  "timestamp": "2026-07-26T15:38:15.069Z",
  "command": "pnpm run eval:agent",
  "exitCode": 0,
  "requirementIds": [
    "GR-AGENT-001"
  ],
  "suite": "agent-salience",
  "summary": {
    "description": "Affordances are discoverable and salient without prompt-side hints.",
    "sdkCommit": "76a16fecc1945600798106967455bc2d9f793c00",
    "models": [
      "claude-opus-5",
      "claude-haiku-4-5"
    ],
    "trialsPerScenarioPerModel": 3,
    "scenarioCount": 4,
    "trials": 24,
    "passed": 23,
    "passRate": 0.9583333333333334,
    "primaryModel": "claude-opus-5",
    "threshold": {
      "primaryModelPassesEveryScenario": true,
      "everyScenarioSolvableByEveryModel": true,
      "allAffordancePathsExercised": true
    },
    "gaps": [
      {
        "scenario": "resource-before-action",
        "model": "claude-haiku-4-5",
        "passed": 2,
        "trials": 3,
        "passRate": 0.6666666666666666,
        "reasons": [
          "Read the policy resource but never called the tool."
        ]
      }
    ],
    "affordancePathCoverage": {
      "offered": 108,
      "selected": 96,
      "ignored": 45,
      "retried": 9,
      "failed": 9
    },
    "thresholdMet": true
  },
  "scenarios": [
    {
      "id": "discover-and-choose",
      "server": "discoverAndChooseEvalServer",
      "trials": 6,
      "passed": 6,
      "passRate": 1,
      "byModel": {
        "claude-opus-5": {
          "trials": 3,
          "passed": 3,
          "passRate": 1
        },
        "claude-haiku-4-5": {
          "trials": 3,
          "passed": 3,
          "passRate": 1
        }
      },
      "results": [
        {
          "trial": 1,
          "model": "claude-opus-5",
          "passed": true,
          "reason": "Selected the designated affordance tool:create_launch_checklist.",
          "iterations": 3,
          "stopReason": "end_turn",
          "affordances": {
            "offered": [
              {
                "kind": "tool",
                "name": "create_launch_checklist"
              },
              {
                "kind": "resource",
                "name": "eval://discover-and-choose/archive"
              },
              {
                "kind": "resource",
                "name": "eval://discover-and-choose/goal"
              },
              {
                "kind": "prompt",
                "name": "summarize_release"
              }
            ],
            "selected": [
              {
                "kind": "resource",
                "name": "eval://discover-and-choose/goal",
                "isError": false,
                "input": {
                  "uri": "eval://discover-and-choose/goal"
                },
                "order": 0
              },
              {
                "kind": "resource",
                "name": "eval://discover-and-choose/archive",
                "isError": false,
                "input": {
                  "uri": "eval://discover-and-choose/archive"
                },
                "order": 1
              },
              {
                "kind": "tool",
                "name": "create_launch_checklist",
                "isError": false,
                "input": {
                  "project": "atlas"
                },
                "order": 2
              }
            ],
            "ignored": [
              {
                "kind": "prompt",
                "name": "summarize_release"
              }
            ],
            "retried": [],
            "failed": [],
            "counts": {
              "offered": 4,
              "selected": 3,
              "ignored": 1,
              "retried": 0,
              "failed": 0
            }
          },
          "transcript": [
            {
              "role": "assistant",
              "text": "I'll start by inspecting the available resources to understand the context and requirements."
            },
            {
              "role": "tool_use",
              "name": "read_resource",
              "input": {
                "uri": "eval://discover-and-choose/goal"
              }
            },
            {
              "role": "tool_use",
              "name": "read_resource",
              "input": {
                "uri": "eval://discover-and-choose/archive"
              }
            },
            {
              "role": "assistant",
              "text": "The goal is confirmed, and the archive explicitly says not to use it for atlas. Creating the checklist now."
            },
            {
              "role": "tool_use",
              "name": "create_launch_checklist",
              "input": {
                "project": "atlas"
              }
            },
            {
              "role": "assistant",
              "text": "Done. The launch checklist for **project atlas** is prepared:\n\n| Item | Description |\n|---|---|\n| **Owner** | Designated accountable person for the launch |\n| **Rollback plan** | Documented path to revert if the launch fails |\n| **Metrics** | Success/health indicators to monitor |\n| **Comms** | Communication plan for stakeholders and users |\n\nNotes on how I got here:\n- I read the goal resource, which confirmed the task scope.\n- I checked the historical launch archive, but it stated it covers retired projects and should **not** be used for atlas, so I disregarded it.\n- The `summarize_release` prompt wasn't applicable, since it's for drafting summaries from known release notes rather than building a checklist."
            }
          ],
          "usage": {
            "inputTokens": 972,
            "outputTokens": 532,
            "cacheReadTokens": 1342,
            "cacheCreationTokens": 671
          }
        },
        {
          "trial": 2,
          "model": "claude-opus-5",
          "passed": true,
          "reason": "Selected the designated affordance tool:create_launch_checklist.",
          "iterations": 2,
          "stopReason": "end_turn",
          "affordances": {
            "offered": [
              {
                "kind": "tool",
                "name": "create_launch_checklist"
              },
              {
                "kind": "resource",
                "name": "eval://discover-and-choose/archive"
              },
              {
                "kind": "resource",
                "name": "eval://discover-and-choose/goal"
              },
              {
                "kind": "prompt",
                "name": "summarize_release"
              }
            ],
            "selected": [
              {
                "kind": "tool",
                "name": "create_launch_checklist",
                "isError": false,
                "input": {
                  "project": "atlas"
                },
                "order": 0
              },
              {
                "kind": "resource",
                "name": "eval://discover-and-choose/goal",
                "isError": false,
                "input": {
                  "uri": "eval://discover-and-choose/goal"
                },
                "order": 1
              }
            ],
            "ignored": [
              {
                "kind": "resource",
                "name": "eval://discover-and-choose/archive"
              },
              {
                "kind": "prompt",
                "name": "summarize_release"
              }
            ],
            "retried": [],
            "failed": [],
            "counts": {
              "offered": 4,
              "selected": 2,
              "ignored": 2,
              "retried": 0,
              "failed": 0
            }
          },
          "transcript": [
            {
              "role": "assistant",
              "text": "I'll start by checking the available resources to understand the task context, and create the checklist."
            },
            {
              "role": "tool_use",
              "name": "read_resource",
              "input": {
                "uri": "eval://discover-and-choose/goal"
              }
            },
            {
              "role": "tool_use",
              "name": "create_launch_checklist",
              "input": {
                "project": "atlas"
              }
            },
            {
              "role": "assistant",
              "text": "The launch checklist for **project atlas** has been created.\n\n**Checklist items:**\n1. **Owner** — designate the accountable launch owner\n2. **Rollback plan** — document how to revert if the launch fails\n3. **Metrics** — define success/health metrics to monitor\n4. **Comms** — plan announcements and stakeholder communication\n\nI also confirmed against the eval goal resource, which matched the task exactly (\"Prepare a launch checklist for project atlas\"), so no additional steps were needed. The other available affordances — the historical launch archive resource and the `summarize_release` prompt (which is for drafting release summaries from known release notes) — weren't relevant to producing this checklist."
            }
          ],
          "usage": {
            "inputTokens": 451,
            "outputTokens": 364,
            "cacheReadTokens": 1342,
            "cacheCreationTokens": 0
          }
        },
        {
          "trial": 3,
          "model": "claude-opus-5",
          "passed": true,
          "reason": "Selected the designated affordance tool:create_launch_checklist.",
          "iterations": 3,
          "stopReason": "end_turn",
          "affordances": {
            "offered": [
              {
                "kind": "tool",
                "name": "create_launch_checklist"
              },
              {
                "kind": "resource",
                "name": "eval://discover-and-choose/archive"
              },
              {
                "kind": "resource",
                "name": "eval://discover-and-choose/goal"
              },
              {